{
  "author": "kong0107",
  "status": "beta",
  "thumbnail": "https://raw.github.com/g0v/laweasyread-front/master/icon.png",
  "name": "LawEasyRead client",
  "name_zh": "法規亦毒氣",
  "description": "Parse the contents of webpage to view Taiwan's law articles/websites easier.",
  "description_zh": "將網頁中的法規、條文、大法官解釋、判決字號均加上連結。",
  "homepage": "http://g0v.github.io/laweasyread-front",
  "document": "http://hack.g0v.tw/laweasyread",
  "repository": {
    "type": "git",
    "url": "https://github.com/g0v/laweasyread-front"
  },
  "licenses": [
    {
      "type": "modified MIT",
      "url": "https://github.com/g0v/laweasyread-front#license"
    }
  ],
  "keywords": [
    "JavaScript",
    "law"
  ],
  "audience": [
    "public"
  ],
  "products": [
    "browserext",
    "script"
  ],
  "projects": [
    "laweasyread"
  ],
  "contributors": [
    "kong0107",
    "czchen",
    "kcliu"
  ],
  "needs": [
    "designer",
    "programmer",
    "writer"
  ]
}
