{
  "author": "kcwu",
  "status": "stable",
  "name": "moedict-data",
  "description": "Parsed dictionary data from Ministry of Education",
  "description_zh": "教育部重編國語辭典 資料檔",
  "homepage": "http://3du.tw/",
  "document": "https://github.com/g0v/moedict-process/wiki",
  "repository": {
    "type": "git",
    "url": "https://github.com/g0v/moedict-data"
  },
  "licenses": [
    {
      "type": "MIT"
    }
  ],
  "keywords": [
    "dictionary",
    "json"
  ],
  "audience": [
    "developer"
  ],
  "products": [
    "data"
  ],
  "projects": [
    "3du"
  ],
  "contributors": [
    "au",
    "kcwu",
    "poga"
  ],
  "needs": []
}
