{
  "author": "racklin",
  "status": "beta",
  "name": "moedict-jquery-plugin",
  "name_zh": "萌典 jQuery Plugin",
  "description": "Moedict.tw jQuery Plugin",
  "description_zh": "萌典 jQuery Plugin",
  "homepage": "https://github.com/racklin/moedict-jquery-plugin",
  "repository": {
    "type": "git",
    "url": "https://github.com/racklin/moedict-jquery-plugin"
  },
  "keywords": [
    "jquery",
    "dictioanary",
    "livescript",
    "javascript"
  ],
  "audience": [
    "public"
  ],
  "products": [
    "dictionary"
  ],
  "projects": [
    "3du"
  ],
  "contributors": [
    "racklin"
  ],
  "needs": []
}
