{
  "author": "hychen",
  "contributors": [
    "Brecht",
    "kcliu"
  ],
  "status": "alpha",
  "name": "kuansim-frontend",
  "name_zh": "鄉民關心你 - 社會議題追蹤分析網站 前端",
  "description": "society issue tracking system",
  "description_zh": "追蹤各議題狀態以做決策",
  "document": "http://hack.g0v.tw/kuansim",
  "repository": {
    "type": "git",
    "url": "https://github.com/g0v/kuansim-frontend"
  },
  "licenses": [
    {
      "type": "BSD"
    }
  ],
  "keywords": [
    "angularjs",
    "livescript",
    "sass",
    "bootstrap"
  ],
  "audience": [
    "public"
  ],
  "products": [
    "website"
  ],
  "projects": [
    "kuansim"
  ],
  "thumbnail": "",
  "needs": [
    "designer",
    "programmer",
    "writer"
  ]
}
