{
  "author": "bater",
  "contributors": [
    "bater",
    "fntsrlike"
  ],
  "status": "beta",
  "homepage": "http://va.twbbs.org/",
  "name": "VotesAnalysis",
  "name_zh": "選 票 成 份 分 析",
  "description": "Let us know which one legislator (Or politicians) and their position closest to the voters.",
  "description_zh": "了解哪一個立委(政治人物)與選民自己的立場最接近。",
  "document": "https://g0v.hackpad.com/YpOT9vjLthf",
  "repository": {
    "type": "git",
    "url": "https://github.com/g0v-tw-congress-vote-analytics/congress-vote-analytics-beta"
  },
  "licenses": [
    {
      "type": "MIT License"
    }
  ],
  "keywords": [
    "bater",
    "立法院"
  ],
  "audience": [
    "public"
  ],
  "products": [
    "website"
  ],
  "projects": [
    "立法院小組"
  ],
  "thumbnail": "",
  "needs": [
    "designer",
    "programmer",
    "writer"
  ]
}
