{
  "author": "au",
  "status": "beta",
  "name": "moedict",
  "description": "'Amis moedict: Dictionaries from Safolu Kacaw Lalanges, Virginia Fey, Louis Pourrias, Maurice Poinsot",
  "description_zh": "阿美語萌典，目前有蔡中涵、方敏英、博利亞、潘世光字典",
  "homepage": "https://moedict.tw/",
  "document": "http://3du.tw/",
  "repository": {
    "type": "git",
    "url": "https://github.com/g0v/amis-moedict"
  },
  "licenses": [
    {
      "type": "CC0"
    }
  ],
  "keywords": [
    "nodejs",
    "react",
    "scss",
    "bootstrap3"
  ],
  "audience": [
    "contributor"
  ],
  "products": [
    "website", "app"
  ],
  "projects": [
    "3du"
  ],
  "contributors": [
    "wildjcrt",
    "miaoski",
    "audreyt",
    "leo424y",
    "moon_c",
    "misscs",
    "a-tsioh",
    "PeterDaveHello",
    "yhsiang",
    "caasi",
    "viirya",
    "gugod",
    "ethantw"
  ],
  "thumbnail": [
    "https://amis.moedict.tw/2017-Amis-Logo.png"
  ],
  "needs": [
    "programmer",
    "designer",
    "txt"
  ]
}
