{
  "author": "Bert Wang",
  "contributors": [
    "Bert Wang"
  ],
  "status": "alpha",
  "homepage": "http://hack.g0v.tw/abroadplay/nOWhTpJPKx7",
  "name": "abroadplay",
  "name_zh": "公務員出國考察追蹤網",
  "description": "tracking abroad - stroke, the number",
  "description_zh": "追蹤公務員出國考察的-行程、人數",
  "document": "我們公務人員出國考察其實是很像挖馬路，除了很浮濫，而且常常是一再重覆。常常金管會、經濟部、經建會大家都去考察，或是每年4Q為了消化預算，就是考察旺季，讓外館人員應接不暇。這對一個財政吃緊的國家是沒有必要的浪費。更不要講一堆被考察的城市都是些知名觀光景點。",
  "repository": {
    "type": "git",
    "url": "https://github.com/g0v/abroadplay"
  },
  "licenses": [
    {
      "type": ""
    }
  ],
  "keywords": [
    "abroad"
  ],
  "audience": [
    "public"
  ],
  "products": [
    "website"
  ],
  "projects": [
    "abroadplay"
  ],
  "thumbnail": "",
  "needs": [
    "designer",
    "programmer",
    "writer"
  ]
}
